
T:  Bus=01 Lev=00 Prnt=00 Port=00 Cnt=00 Dev#=  1 Spd=480  MxCh=16
B:  Alloc=  0/800 us ( 0%), #Int=  0, #Iso=  0
D:  Ver= 2.00 Cls=09(hub  ) Sub=00 Prot=01 MxPS=64 #Cfgs=  1
P:  Vendor=1d6b ProdID=0002 Rev= 5.10
S:  Manufacturer=Linux 5.10.14-arch1-1 xhci-hcd
S:  Product=xHCI Host Controller
S:  SerialNumber=0000:00:14.0
C:* #Ifs= 1 Cfg#= 1 Atr=e0 MxPwr=  0mA
I:* If#= 0 Alt= 0 #EPs= 1 Cls=09(hub  ) Sub=00 Prot=00 Driver=hub
E:  Ad=81(I) Atr=03(Int.) MxPS=   4 Ivl=256ms

T:  Bus=01 Lev=01 Prnt=01 Port=12 Cnt=01 Dev#=  9 Spd=480  MxCh= 4
D:  Ver= 2.10 Cls=09(hub  ) Sub=00 Prot=02 MxPS=64 #Cfgs=  1
P:  Vendor=0bda ProdID=5411 Rev= 1.23
S:  Manufacturer=Generic
S:  Product=4-Port USB 2.0 Hub
C:* #Ifs= 1 Cfg#= 1 Atr=e0 MxPwr=100mA
I:  If#= 0 Alt= 0 #EPs= 1 Cls=09(hub  ) Sub=00 Prot=01 Driver=hub
E:  Ad=81(I) Atr=03(Int.) MxPS=   1 Ivl=256ms
I:* If#= 0 Alt= 1 #EPs= 1 Cls=09(hub  ) Sub=00 Prot=02 Driver=hub
E:  Ad=81(I) Atr=03(Int.) MxPS=   1 Ivl=256ms

T:  Bus=01 Lev=02 Prnt=09 Port=00 Cnt=01 Dev#= 27 Spd=480  MxCh= 0
D:  Ver= 2.00 Cls=ef(misc ) Sub=02 Prot=01 MxPS=64 #Cfgs=  1
P:  Vendor=046d ProdID=082d Rev= 0.11
S:  Product=HD Pro Webcam C920
S:  SerialNumber=AEBA6B7F
C:* #Ifs= 4 Cfg#= 1 Atr=80 MxPwr=500mA
A:  FirstIf#= 0 IfCount= 2 Cls=0e(video) Sub=03 Prot=00
A:  FirstIf#= 2 IfCount= 2 Cls=01(audio) Sub=02 Prot=00
I:* If#= 0 Alt= 0 #EPs= 1 Cls=0e(video) Sub=01 Prot=00 Driver=uvcvideo
E:  Ad=83(I) Atr=03(Int.) MxPS=  64 Ivl=16ms
I:* If#= 1 Alt= 0 #EPs= 0 Cls=0e(video) Sub=02 Prot=00 Driver=uvcvideo
I:  If#= 1 Alt= 1 #EPs= 1 Cls=0e(video) Sub=02 Prot=00 Driver=uvcvideo
E:  Ad=81(I) Atr=05(Isoc) MxPS= 192 Ivl=125us
I:  If#= 1 Alt= 2 #EPs= 1 Cls=0e(video) Sub=02 Prot=00 Driver=uvcvideo
E:  Ad=81(I) Atr=05(Isoc) MxPS= 384 Ivl=125us
I:  If#= 1 Alt= 3 #EPs= 1 Cls=0e(video) Sub=02 Prot=00 Driver=uvcvideo
E:  Ad=81(I) Atr=05(Isoc) MxPS= 512 Ivl=125us
I:  If#= 1 Alt= 4 #EPs= 1 Cls=0e(video) Sub=02 Prot=00 Driver=uvcvideo
E:  Ad=81(I) Atr=05(Isoc) MxPS= 640 Ivl=125us
I:  If#= 1 Alt= 5 #EPs= 1 Cls=0e(video) Sub=02 Prot=00 Driver=uvcvideo
E:  Ad=81(I) Atr=05(Isoc) MxPS= 800 Ivl=125us
I:  If#= 1 Alt= 6 #EPs= 1 Cls=0e(video) Sub=02 Prot=00 Driver=uvcvideo
E:  Ad=81(I) Atr=05(Isoc) MxPS= 944 Ivl=125us
I:  If#= 1 Alt= 7 #EPs= 1 Cls=0e(video) Sub=02 Prot=00 Driver=uvcvideo
E:  Ad=81(I) Atr=05(Isoc) MxPS=1280 Ivl=125us
I:  If#= 1 Alt= 8 #EPs= 1 Cls=0e(video) Sub=02 Prot=00 Driver=uvcvideo
E:  Ad=81(I) Atr=05(Isoc) MxPS=1600 Ivl=125us
I:  If#= 1 Alt= 9 #EPs= 1 Cls=0e(video) Sub=02 Prot=00 Driver=uvcvideo
E:  Ad=81(I) Atr=05(Isoc) MxPS=1984 Ivl=125us
I:  If#= 1 Alt=10 #EPs= 1 Cls=0e(video) Sub=02 Prot=00 Driver=uvcvideo
E:  Ad=81(I) Atr=05(Isoc) MxPS=2688 Ivl=125us
I:  If#= 1 Alt=11 #EPs= 1 Cls=0e(video) Sub=02 Prot=00 Driver=uvcvideo
E:  Ad=81(I) Atr=05(Isoc) MxPS=3060 Ivl=125us
I:* If#= 2 Alt= 0 #EPs= 0 Cls=01(audio) Sub=01 Prot=00 Driver=snd-usb-audio
I:* If#= 3 Alt= 0 #EPs= 0 Cls=01(audio) Sub=02 Prot=00 Driver=snd-usb-audio
I:  If#= 3 Alt= 1 #EPs= 1 Cls=01(audio) Sub=02 Prot=00 Driver=snd-usb-audio
E:  Ad=82(I) Atr=05(Isoc) MxPS=  68 Ivl=1ms
I:  If#= 3 Alt= 2 #EPs= 1 Cls=01(audio) Sub=02 Prot=00 Driver=snd-usb-audio
E:  Ad=82(I) Atr=05(Isoc) MxPS= 100 Ivl=1ms
I:  If#= 3 Alt= 3 #EPs= 1 Cls=01(audio) Sub=02 Prot=00 Driver=snd-usb-audio
E:  Ad=82(I) Atr=05(Isoc) MxPS= 132 Ivl=1ms

T:  Bus=01 Lev=02 Prnt=09 Port=02 Cnt=02 Dev#= 30 Spd=480  MxCh= 0
D:  Ver= 2.00 Cls=ef(misc ) Sub=02 Prot=01 MxPS=64 #Cfgs=  1
P:  Vendor=1fc9 ProdID=0090 Rev= 1.00
S:  Manufacturer=NXP Semiconductors
S:  Product=LPC-LINK2 CMSIS-DAP V5.361
S:  SerialNumber=FTCUMQIS
C:* #Ifs= 5 Cfg#= 1 Atr=80 MxPwr=500mA
A:  FirstIf#= 1 IfCount= 2 Cls=02(comm.) Sub=02 Prot=00
I:* If#= 0 Alt= 0 #EPs= 2 Cls=03(HID  ) Sub=00 Prot=00 Driver=usbhid
E:  Ad=81(I) Atr=03(Int.) MxPS=1024 Ivl=125us
E:  Ad=01(O) Atr=03(Int.) MxPS=1024 Ivl=125us
I:* If#= 4 Alt= 0 #EPs= 2 Cls=03(HID  ) Sub=00 Prot=00 Driver=usbhid
E:  Ad=84(I) Atr=03(Int.) MxPS=1024 Ivl=250us
E:  Ad=04(O) Atr=03(Int.) MxPS=1024 Ivl=250us
I:* If#= 1 Alt= 0 #EPs= 1 Cls=02(comm.) Sub=02 Prot=00 Driver=cdc_acm
E:  Ad=83(I) Atr=03(Int.) MxPS=  16 Ivl=1ms
I:* If#= 2 Alt= 0 #EPs= 2 Cls=0a(data ) Sub=00 Prot=00 Driver=cdc_acm
E:  Ad=02(O) Atr=02(Bulk) MxPS= 512 Ivl=0ms
E:  Ad=82(I) Atr=02(Bulk) MxPS= 512 Ivl=0ms
I:* If#= 3 Alt= 0 #EPs= 2 Cls=03(HID  ) Sub=00 Prot=00 Driver=usbhid
E:  Ad=85(I) Atr=03(Int.) MxPS=  64 Ivl=500us
E:  Ad=05(O) Atr=03(Int.) MxPS=  64 Ivl=500us

T:  Bus=01 Lev=02 Prnt=09 Port=03 Cnt=03 Dev#= 13 Spd=480  MxCh= 4
D:  Ver= 2.10 Cls=09(hub  ) Sub=00 Prot=02 MxPS=64 #Cfgs=  1
P:  Vendor=0bda ProdID=5411 Rev= 1.23
S:  Manufacturer=Generic
S:  Product=4-Port USB 2.0 Hub
C:* #Ifs= 1 Cfg#= 1 Atr=e0 MxPwr=100mA
I:  If#= 0 Alt= 0 #EPs= 1 Cls=09(hub  ) Sub=00 Prot=01 Driver=hub
E:  Ad=81(I) Atr=03(Int.) MxPS=   1 Ivl=256ms
I:* If#= 0 Alt= 1 #EPs= 1 Cls=09(hub  ) Sub=00 Prot=02 Driver=hub
E:  Ad=81(I) Atr=03(Int.) MxPS=   1 Ivl=256ms

T:  Bus=01 Lev=03 Prnt=13 Port=00 Cnt=01 Dev#= 28 Spd=12   MxCh= 0
D:  Ver= 2.00 Cls=00(>ifc ) Sub=00 Prot=00 MxPS= 8 #Cfgs=  1
P:  Vendor=046d ProdID=c52b Rev=12.11
S:  Manufacturer=Logitech
S:  Product=USB Receiver
C:* #Ifs= 3 Cfg#= 1 Atr=a0 MxPwr= 98mA
I:* If#= 0 Alt= 0 #EPs= 1 Cls=03(HID  ) Sub=01 Prot=01 Driver=usbhid
E:  Ad=81(I) Atr=03(Int.) MxPS=   8 Ivl=8ms
I:* If#= 1 Alt= 0 #EPs= 1 Cls=03(HID  ) Sub=01 Prot=02 Driver=usbhid
E:  Ad=82(I) Atr=03(Int.) MxPS=   8 Ivl=2ms
I:* If#= 2 Alt= 0 #EPs= 1 Cls=03(HID  ) Sub=00 Prot=00 Driver=usbhid
E:  Ad=83(I) Atr=03(Int.) MxPS=  32 Ivl=2ms

T:  Bus=01 Lev=03 Prnt=13 Port=02 Cnt=02 Dev#= 15 Spd=12   MxCh= 0
D:  Ver= 2.00 Cls=e0(wlcon) Sub=01 Prot=01 MxPS=64 #Cfgs=  1
P:  Vendor=0a12 ProdID=0001 Rev=88.91
S:  Product=CSR8510 A10
C:* #Ifs= 2 Cfg#= 1 Atr=e0 MxPwr=100mA
I:* If#= 0 Alt= 0 #EPs= 3 Cls=e0(wlcon) Sub=01 Prot=01 Driver=btusb
E:  Ad=81(I) Atr=03(Int.) MxPS=  16 Ivl=1ms
E:  Ad=02(O) Atr=02(Bulk) MxPS=  64 Ivl=0ms
E:  Ad=82(I) Atr=02(Bulk) MxPS=  64 Ivl=0ms
I:* If#= 1 Alt= 0 #EPs= 2 Cls=e0(wlcon) Sub=01 Prot=01 Driver=btusb
E:  Ad=03(O) Atr=01(Isoc) MxPS=   0 Ivl=1ms
E:  Ad=83(I) Atr=01(Isoc) MxPS=   0 Ivl=1ms
I:  If#= 1 Alt= 1 #EPs= 2 Cls=e0(wlcon) Sub=01 Prot=01 Driver=btusb
E:  Ad=03(O) Atr=01(Isoc) MxPS=   9 Ivl=1ms
E:  Ad=83(I) Atr=01(Isoc) MxPS=   9 Ivl=1ms
I:  If#= 1 Alt= 2 #EPs= 2 Cls=e0(wlcon) Sub=01 Prot=01 Driver=btusb
E:  Ad=03(O) Atr=01(Isoc) MxPS=  17 Ivl=1ms
E:  Ad=83(I) Atr=01(Isoc) MxPS=  17 Ivl=1ms
I:  If#= 1 Alt= 3 #EPs= 2 Cls=e0(wlcon) Sub=01 Prot=01 Driver=btusb
E:  Ad=03(O) Atr=01(Isoc) MxPS=  25 Ivl=1ms
E:  Ad=83(I) Atr=01(Isoc) MxPS=  25 Ivl=1ms
I:  If#= 1 Alt= 4 #EPs= 2 Cls=e0(wlcon) Sub=01 Prot=01 Driver=btusb
E:  Ad=03(O) Atr=01(Isoc) MxPS=  33 Ivl=1ms
E:  Ad=83(I) Atr=01(Isoc) MxPS=  33 Ivl=1ms
I:  If#= 1 Alt= 5 #EPs= 2 Cls=e0(wlcon) Sub=01 Prot=01 Driver=btusb
E:  Ad=03(O) Atr=01(Isoc) MxPS=  49 Ivl=1ms
E:  Ad=83(I) Atr=01(Isoc) MxPS=  49 Ivl=1ms

T:  Bus=01 Lev=03 Prnt=13 Port=03 Cnt=03 Dev#= 14 Spd=12   MxCh= 0
D:  Ver= 2.00 Cls=00(>ifc ) Sub=00 Prot=00 MxPS=64 #Cfgs=  1
P:  Vendor=1050 ProdID=0200 Rev= 0.97
S:  Manufacturer=Yubico
S:  Product=Yubico Gnubby (gnubby1)
C:* #Ifs= 1 Cfg#= 1 Atr=80 MxPwr= 30mA
I:* If#= 0 Alt= 0 #EPs= 2 Cls=03(HID  ) Sub=00 Prot=00 Driver=usbhid
E:  Ad=81(I) Atr=03(Int.) MxPS=  64 Ivl=2ms
E:  Ad=01(O) Atr=03(Int.) MxPS=  64 Ivl=2ms

T:  Bus=02 Lev=00 Prnt=00 Port=00 Cnt=00 Dev#=  1 Spd=5000 MxCh=10
B:  Alloc=  0/800 us ( 0%), #Int=  0, #Iso=  0
D:  Ver= 3.00 Cls=09(hub  ) Sub=00 Prot=03 MxPS= 9 #Cfgs=  1
P:  Vendor=1d6b ProdID=0003 Rev= 5.10
S:  Manufacturer=Linux 5.10.14-arch1-1 xhci-hcd
S:  Product=xHCI Host Controller
S:  SerialNumber=0000:00:14.0
C:* #Ifs= 1 Cfg#= 1 Atr=e0 MxPwr=  0mA
I:* If#= 0 Alt= 0 #EPs= 1 Cls=09(hub  ) Sub=00 Prot=00 Driver=hub
E:  Ad=81(I) Atr=03(Int.) MxPS=   4 Ivl=256ms

T:  Bus=03 Lev=00 Prnt=00 Port=00 Cnt=00 Dev#=  1 Spd=480  MxCh= 2
B:  Alloc=  0/800 us ( 0%), #Int=  0, #Iso=  0
D:  Ver= 2.00 Cls=09(hub  ) Sub=00 Prot=01 MxPS=64 #Cfgs=  1
P:  Vendor=1d6b ProdID=0002 Rev= 5.10
S:  Manufacturer=Linux 5.10.14-arch1-1 xhci-hcd
S:  Product=xHCI Host Controller
S:  SerialNumber=0000:01:00.2
C:* #Ifs= 1 Cfg#= 1 Atr=e0 MxPwr=  0mA
I:* If#= 0 Alt= 0 #EPs= 1 Cls=09(hub  ) Sub=00 Prot=00 Driver=hub
E:  Ad=81(I) Atr=03(Int.) MxPS=   4 Ivl=256ms

T:  Bus=04 Lev=00 Prnt=00 Port=00 Cnt=00 Dev#=  1 Spd=10000 MxCh= 4
B:  Alloc=  0/800 us ( 0%), #Int=  0, #Iso=  0
D:  Ver= 3.10 Cls=09(hub  ) Sub=00 Prot=03 MxPS= 9 #Cfgs=  1
P:  Vendor=1d6b ProdID=0003 Rev= 5.10
S:  Manufacturer=Linux 5.10.14-arch1-1 xhci-hcd
S:  Product=xHCI Host Controller
S:  SerialNumber=0000:01:00.2
C:* #Ifs= 1 Cfg#= 1 Atr=e0 MxPwr=  0mA
I:* If#= 0 Alt= 0 #EPs= 1 Cls=09(hub  ) Sub=00 Prot=00 Driver=hub
E:  Ad=81(I) Atr=03(Int.) MxPS=   4 Ivl=256ms

T:  Bus=05 Lev=00 Prnt=00 Port=00 Cnt=00 Dev#=  1 Spd=480  MxCh= 2
B:  Alloc=  0/800 us ( 0%), #Int=  0, #Iso=  0
D:  Ver= 2.00 Cls=09(hub  ) Sub=00 Prot=01 MxPS=64 #Cfgs=  1
P:  Vendor=1d6b ProdID=0002 Rev= 5.10
S:  Manufacturer=Linux 5.10.14-arch1-1 xhci-hcd
S:  Product=xHCI Host Controller
S:  SerialNumber=0000:05:00.0
C:* #Ifs= 1 Cfg#= 1 Atr=e0 MxPwr=  0mA
I:* If#= 0 Alt= 0 #EPs= 1 Cls=09(hub  ) Sub=00 Prot=00 Driver=hub
E:  Ad=81(I) Atr=03(Int.) MxPS=   4 Ivl=256ms

T:  Bus=05 Lev=01 Prnt=01 Port=01 Cnt=01 Dev#= 40 Spd=480  MxCh= 5
D:  Ver= 2.10 Cls=09(hub  ) Sub=00 Prot=02 MxPS=64 #Cfgs=  1
P:  Vendor=0424 ProdID=2734 Rev= 1.29
S:  Manufacturer=Microchip Tech
S:  Product=USB2734
C:* #Ifs= 1 Cfg#= 1 Atr=e0 MxPwr=  0mA
I:  If#= 0 Alt= 0 #EPs= 1 Cls=09(hub  ) Sub=00 Prot=01 Driver=hub
E:  Ad=81(I) Atr=03(Int.) MxPS=   1 Ivl=256ms
I:* If#= 0 Alt= 1 #EPs= 1 Cls=09(hub  ) Sub=00 Prot=02 Driver=hub
E:  Ad=81(I) Atr=03(Int.) MxPS=   1 Ivl=256ms

T:  Bus=05 Lev=02 Prnt=40 Port=03 Cnt=01 Dev#= 42 Spd=480  MxCh= 0
D:  Ver= 1.10 Cls=00(>ifc ) Sub=00 Prot=00 MxPS=64 #Cfgs=  1
P:  Vendor=1209 ProdID=345c Rev= 0.01
S:  Manufacturer="https://github.com/stapelberg"
S:  Product="kinT (kint41)"
C:* #Ifs= 2 Cfg#= 1 Atr=a0 MxPwr=500mA
I:* If#= 0 Alt= 0 #EPs= 1 Cls=03(HID  ) Sub=01 Prot=01 Driver=usbhid
E:  Ad=81(I) Atr=03(Int.) MxPS=   8 Ivl=125us
I:* If#= 1 Alt= 0 #EPs= 1 Cls=03(HID  ) Sub=00 Prot=00 Driver=usbhid
E:  Ad=82(I) Atr=03(Int.) MxPS=  32 Ivl=125us

T:  Bus=05 Lev=02 Prnt=40 Port=04 Cnt=02 Dev#= 41 Spd=480  MxCh= 0
D:  Ver= 2.01 Cls=00(>ifc ) Sub=00 Prot=00 MxPS=64 #Cfgs=  1
P:  Vendor=0424 ProdID=274c Rev= 2.00
S:  Manufacturer=Microchip Tech
S:  Product=Hub Controller
C:* #Ifs= 2 Cfg#= 1 Atr=c0 MxPwr=  0mA
I:* If#= 0 Alt= 0 #EPs= 0 Cls=ff(vend.) Sub=ff Prot=ff Driver=(none)
I:* If#= 1 Alt= 0 #EPs= 2 Cls=03(HID  ) Sub=00 Prot=00 Driver=usbhid
E:  Ad=81(I) Atr=03(Int.) MxPS=  64 Ivl=125us
E:  Ad=01(O) Atr=03(Int.) MxPS=  64 Ivl=125us

T:  Bus=06 Lev=00 Prnt=00 Port=00 Cnt=00 Dev#=  1 Spd=10000 MxCh= 2
B:  Alloc=  0/800 us ( 0%), #Int=  0, #Iso=  0
D:  Ver= 3.10 Cls=09(hub  ) Sub=00 Prot=03 MxPS= 9 #Cfgs=  1
P:  Vendor=1d6b ProdID=0003 Rev= 5.10
S:  Manufacturer=Linux 5.10.14-arch1-1 xhci-hcd
S:  Product=xHCI Host Controller
S:  SerialNumber=0000:05:00.0
C:* #Ifs= 1 Cfg#= 1 Atr=e0 MxPwr=  0mA
I:* If#= 0 Alt= 0 #EPs= 1 Cls=09(hub  ) Sub=00 Prot=00 Driver=hub
E:  Ad=81(I) Atr=03(Int.) MxPS=   4 Ivl=256ms

T:  Bus=06 Lev=01 Prnt=01 Port=01 Cnt=01 Dev#= 39 Spd=5000 MxCh= 4
D:  Ver= 3.10 Cls=09(hub  ) Sub=00 Prot=03 MxPS= 9 #Cfgs=  1
P:  Vendor=0424 ProdID=5734 Rev= 1.29
S:  Manufacturer=Microchip Tech
S:  Product=USB5734
C:* #Ifs= 1 Cfg#= 1 Atr=e0 MxPwr=  0mA
I:* If#= 0 Alt= 0 #EPs= 1 Cls=09(hub  ) Sub=00 Prot=00 Driver=hub
E:  Ad=81(I) Atr=13(Int.) MxPS=   2 Ivl=16ms
