Extracted contents:
header:          00 ff ff ff ff ff ff 00
serial number:   10 ac 47 41 4c 33 30 30 23 1b
version:         01 04
basic params:    b5 46 27 78 3a
chroma info:     76 45 ae 51 33 ba 26 0d 50 54
established:     a5 4b 00
standard:        81 00 b3 00 d1 00 a9 40 81 80 d1 c0 01 01 01 01
descriptor 1:    4d d0 00 a0 f0 70 3e 80 30 20 35 00 ba 89 21 00 00 1a
descriptor 2:    00 00 00 ff 00 59 34 30 52 59 37 38 55 30 30 33 4c 0a
descriptor 3:    00 00 00 fc 00 44 45 4c 4c 20 55 50 33 32 31 38 4b 0a
descriptor 4:    00 00 00 fd 00 18 4b 1e b4 6c 01 0a 20 20 20 20 20 20
extensions:      02
checksum:        78

Manufacturer: DEL Model 4147 Serial Number 808465228
Made week 35 of 2017
EDID version: 1.4
Digital display
10 bits per primary color channel
DisplayPort interface
Maximum image size: 70 cm x 39 cm
Gamma: 2.20
DPMS levels: Off
Supported color formats: RGB 4:4:4, YCrCb 4:4:4, YCrCb 4:2:2
First detailed timing is preferred timing
Established timings supported:
  720x400@70Hz
  640x480@60Hz
  640x480@75Hz
  800x600@60Hz
  800x600@75Hz
  1024x768@60Hz
  1024x768@75Hz
  1280x1024@75Hz
Standard timings supported:
  1280x800@60Hz
  1680x1050@60Hz
  1920x1200@60Hz
  1600x1200@60Hz
  1280x1024@60Hz
  1920x1080@60Hz
Detailed mode: Clock 533.250 MHz, 698 mm x 393 mm
               3840 3888 3920 4000 hborder 0
               2160 2163 2168 2222 vborder 0
               +hsync -vsync 
Serial number: Y40RY78U003L
Monitor name: DELL
Monitor ranges (bare limits): 24-75Hz V, 30-180kHz H, max dotclock 1080MHz
Has 2 extension blocks
Checksum: 0x78 (valid)

CEA extension block
Extension version: 3
25 bytes of CEA data
  Video data block
    VIC  16 1920x1080@60Hz 
    VIC  31 1920x1080@50Hz 
    VIC  32 1920x1080@24Hz 
    VIC   5 1920x1080i@60Hz 
    VIC  20 1920x1080i@50Hz 
    VIC   4 1280x720@60Hz 
    VIC  19 1280x720@50Hz 
    VIC  18 720x576@50Hz 
    VIC  17 720x576@50Hz 
    VIC   3 720x480@60Hz 
    VIC   2 720x480@60Hz 
    VIC  22 1440x576i@50Hz 
    VIC  21 1440x576i@50Hz 
    VIC   7 1440x480i@60Hz 
    VIC   6 1440x480i@60Hz 
    VIC   1 640x480@60Hz 
  Audio data block
    Linear PCM, max channels 2
    Supported sample rates (kHz): 96 88.2 48 44.1 32
    Supported sample sizes (bits): 24 20 16
  Speaker allocation data block
    Speaker map: FL/FR
Underscans PC formats by default
Basic audio support
Supports YCbCr 4:4:4
Supports YCbCr 4:2:2
1 native detailed modes
Detailed mode: Clock 262.750 MHz, 698 mm x 393 mm
               3840 3888 3920 4000 hborder 0
               2160 2163 2168 2191 vborder 0
               +hsync -vsync 
Detailed mode: Clock 241.500 MHz, 698 mm x 393 mm
               2560 2608 2640 2720 hborder 0
               1440 1443 1448 1481 vborder 0
               +hsync -vsync 
Detailed mode: Clock 147.160 MHz, 698 mm x 393 mm
               2048 2096 2128 2208 hborder 0
               1080 1083 1093 1111 vborder 0
               +hsync -vsync 
Detailed mode: Clock 58.000 MHz, 698 mm x 393 mm
               2048 2096 2128 2208 hborder 0
               1080 1083 1093 1099 vborder 0
               +hsync -vsync 
Checksum: 0x47 (valid)


DisplayID extension block
Extension version: 18
Length 121, version 18, extension count 0
tiled display block: capabilities 0x00000082
num horizontal tiles 2, num vertical tiles 1
tile location (0, 0)
tile dimensions (3840, 4320)
Type 1 detailed timing: aspect: 16:9, Preferred  
Detailed mode: Clock 1030.240 MHz, 0 mm x 0 mm
               7679 7708 7717 7878
               4319 4321 4325 4366
               +hsync -vsync
Type 1 detailed timing: aspect: 16:9, Preferred  
Detailed mode: Clock 826.250 MHz, 0 mm x 0 mm
               7679 7726 7757 7878
               4319 4321 4325 4367
               +hsync -vsync
Type 1 detailed timing: aspect: 16:9,  
Detailed mode: Clock 856.720 MHz, 0 mm x 0 mm
               3839 3886 3917 4038
               4319 4321 4330 4416
               +hsync -vsync
Type 1 detailed timing: aspect: 16:9,  
Detailed mode: Clock 1058.790 MHz, 0 mm x 0 mm
               3839 3886 3917 4038
               4319 4321 4330 4366
               +hsync -vsync

EDID block does NOT conform to EDID 1.3!
	Detailed block string not properly terminated
EDID block does not conform at all!
	Impossible extension block count
